text,label
한쪽 팔에 의수를 하자는 부모님 때문에 팔 없는 나 자신이 더 끔찍하고 싫어져.,0
나한테 이 옷은 정말 소중해.,1
혈압수치가 많이 좋아져 한시름 놓아도 된다고 하니 기뻐.,1
전체 부서 중 우리 부서가 실적 일 등을 했어! 너무 기뻐!,1
건강하고 재정적으로 여유가 있으니 세상이 참 평화로워 보여.,1
남자 친구가 더는 나를 여자로 보지 않는대. 너무 갑작스럽고 마음이 아파.,0
왜 매번 로또에 떨어지지? 오 등이라도 되면 좋겠는데.,0
오늘 아빠한테 잘못한 것도 없이 맞아서 억울해.,0
수학 만점을 받았다는 게 믿기지 않아.,1
예전부터 아껴서 저축했던 돈에 이자가 붙어서 목돈이 생겼어.,1
오늘 장기간 모아둔 적금이 만기되서 찾으러 가는데 벌써 기쁘고 설레여.,1
계약직 근무한 지 일 년째인데 재계약이 될 수 있을지 초조해.,0
부모님이 싸우셔서 걱정이야.,0
엄마가 남자친구 사귀는 건 절대 안 된대서 화가 나.,0
나는 성질이 급한 편인데 내 아들은 느긋느긋한 성격이야.,1
취업 준비가 잘 되지 않아서 우울했는데 오늘 단짝 친구를 만나 영화를 본 후 기분이 좋아졌어.,1
오늘 합격 통지를 받았어. 눈물이 났어.,1
새로 출시된 게임기를 사서 친구에게 보여줬는데 너무 하고 싶어해서 먼저 하게 양보해줬어.,0
오늘 내 생일을 맞아 친구들이 생일파티를 준비해줬어.,1
아들이 재수 끝에 원하던 대기업에 합격해서 너무 기뻐.,1
어떻게 그럴 수가 있지? 친구가 그 직장 동료 편을 들다니 너무 어이가 없어.,0
항암치료를 해도 살 수 있을 것 같지가 않아.,0
부모님은 나한테 관심이 있긴 한 건지 의심스러워.,0
잠을 도통 자지 못해 괴로워 죽겠어.,0
코로나가 점점 심해지고 있어. 나 올해 안에 취업 될까?,0
배우자가 먼저 떠났는데 빈자리를 견디기 너무 힘들어. 우울증이 올 것 같아.,0
여자친구가 임신이 되기 힘든 몸인데 임신을 했어. 기분 좋아서 어떻게 해야 될 지 모르겠어!,1
자녀들이 내 수술 날에 아무도 오지 않았어.,0
내가 병에 걸리자 아내가 나를 떠났어. 배신당한 기분이야.,0
우리 가족은 너무 사랑스러운 것 같아.,1
이번에 수학 시험에서 백 점을 맞았어! 제일 못했던 과목인데.,1
이번에 학과 대표로는 내가 뽑히게 될 것 같아.,1
결혼 준비를 맡긴 업체가 매우 좋아. 믿음직스러워.,1
회사에서 매일 나를 못 살게 굴던 선배가 있었는데 오늘 퇴사했어. 너무 후련해.,1
요즈음 사는 기분이 나.,1
병원에서 신체검사를 했는데 내 나이보다 십 년이나 젊게 나왔어. 정말 기쁘네.,1
요즘 기분이 너무 좋아.,1
건강은 내가 자신 있어.,1
학교 시험 끝내고 진짜 오래간만에 친구랑 걱정 없이 낮잠 잤어.,1
아내 몰래 보험금을 주식에 투자하고 있는데 아내에게 들킬까 봐 걱정이야.,0
남편과 아이들과 함께 하는 요즘이 난 너무 행복해.,1
조금이라도 젊을 때 건강 관리를 할 걸 그랬어. 암에 걸리니까 스스로에게 화가 나.,0
단체 소개팅을 했는데 남자들이 나에게는 말을 별로 안 걸어서 고립된 기분이었어.,0
형이 혼자서 야구 하다가 아빠 도자기를 깰 뻔했어. 안 깨져서 다행이야.,1
공부해야 하는 걸 알아. 알면서도 그냥 자버린 스스로가 원망스러워.,0
나이가 많으면 죽어야 한다고 생각하는 세상이 싫어. 이런 말을 들으면 너무 슬퍼.,0
아파서 누가 도와주지 않으면 내 힘으로 밥도 못 먹는 신세라니 참 괴롭다.,0
일 년 내내 나를 왕따 시켰던 무리가 드디어 징계를 받았어.,1
평소에 복습 많이 해서 오늘 공부를 더 안 해도 내일 시험 잘 볼 수 있을 것 같아!,1
학업에 고민이 많았는데 엄마한테 망설임 없이 이야기했어.,1
체육시간 끝나고 쉬는 시간에 남자애들이 반에서 옷을 갈아입어서 황당했어.,0
아내의 노후 자금이랑 내 노후 자금을 분리해 놓은 덕분에 큰 문제가 발생해도 걱정이 없겠어.,1
내 질환 때문에 이혼하게 된 것 같아서 죄책감이 느껴져.,0
연금을 수령했는데 액수가 상당해.,1
친구가 이제 애들 괴롭히지 않겠다고 약속했는데 또 학교폭력을 저질렀네. 속상해.,0
단짝인 내 동기가 드디어 군대 전역하고 올 학기에 복학한대. 학교생활이 너무 기대돼.,1
우리 반은 내가 반장이라 학우들을 잘 챙기고 있어서 따돌림이 없어. 확신있게 말할 수 있다고.,1
나에 대한 이해가 부족한 배우자 때문에 대인관계가 좁아져서 사회생활이 크게 위축됐어.,0
그동안 나를 고생시켰던 방광염이 다 나아서 너무 기뻐.,1
같은 반 친구가 성적으로 날 무시해서 화가 나.,0
아들이 학교에서 전교 일등을 했다며 성적표를 보여줬어!,1
갑자기 너무 당황스럽네.,0
내 편이 있으면 아무래도 든든하겠지?,0
엄마랑 성적으로 내기했는데 내가 그 이상으로 잘해내서 지금 외식하러 갈 예정이야.,1
내가 가끔 고민 상담하는 친구가 있었는데 나를 엄청나게 신뢰하나 봐. 가정사를 말하는데 나도 이 친구가 신뢰가 가서 좋았어.,1
투병 중에 가정이 있음에도 내가 아프다고 매일같이 와준 자식들에게 너무 고마웠어.,1
와 정말 다행이다.,1
팀장은 너무 싫어.,0
김 씨가 나한테 천식에 좋다고 듣도보도 못한 약을 자꾸 구매하라고 강요해.,0
회사 상사가 나한테 일도 못 하는데 회사에 왜 나오냐고 말을 해서 큰 상처를 받았어.,0
합격자 후기만으로는 내가 제일 어려워하는 면접을 준비하기엔 부족한 것 같아 걱정이야.,0
나는 부모님이나 동생이랑 관계가 요새 많이 안 좋아졌어.,0
정말 몸이 아파서 참석 못한건데 사람을 거짓말쟁이로 만들어.,1
나는 어릴 때 음악 전공을 하고 싶었었지.,0
교통사고가 나서 생명이 위급한 상황에도 가족들은 내게 장기를 이식해주지 않아 버려진 기분이 들었어.,0
요즘 수능 공부한다고 친구들이랑 놀지도 못하고 외로워.,0
요즘 남편과의 관계가 너무 만족스러워.,1
퇴근하고 음식점에 가서 혼자 저녁 먹고 계산하려고 하는데 지갑이 없는 거야!,1
오랫동안 공들였던 기획안이 채택됐어. 이젠 탄탄대로야.,1
내가 좋은 상사라고 소문이 나서 타 부서 직원들이 우리 부서로 오고 싶어 한다니까 행복해!,1
일 재촉 안 하는 상사를 만나서 일처리가 정말 편해.,1
따돌림을 당하고 있기는 하지만 내 옆에 있어 주는 친구가 있어서 너무 든든하고 안심돼.,1
다리에 깁스한 아들의 동료를 걱정했는데 친구들이 많이 도와준다고 하니 안심이야.,1
딸한테 괜히 화를 냈어. 내가 지금 갱년기인 게 딸 잘못도 아닌데.,0
나 이번에 원하는 직장으로 이직했어. 연봉도 만족스러울 만큼 협상이 잘 되었어.,1
이번에 새로 들어간 반에서는 따돌림 대상이 되지 않아서 행운이야.,1
상사와 잘 지낼 수 있을까?,0
우리 집 경비원 선생님들은 참 믿을 만해.,1
어제 남자친구한테 결혼 이야기를 꺼내 봤는데 남자친구가 기대에 찬 눈빛으로 내 말을 들어주더라.,1
앞으로 남은 여생을 어떻게 보내야 할 지 노후에 대한 걱정이 많아지네.,0
아버지가 나한테 토지 하나를 물려주셨는데 정말 큰 도움이 될 것 같아서 아버지께 감사하다고 해야겠어.,1
반 아이들에게 조용히 하라고 했는데 모두가 내 말을 무시했어. 너무 속상해.,0
이번에 시골에 전원주택을 계약되었는데 아내의 기관지염에도 도움이 될 것 같아서 기쁘군.,1
새로운 사람과의 만남은 좋은 것 같아.,0
아직은 귀여운 손녀를 품에 안을 수 있을 정도로 건강해.,1
발표 하다가 갑자기 다 까먹어서 아무 말도 못했어.,0
내가 요즘 관심이 생긴 애가 있는데 생각만 해도 좋아.,1
고등학교 때 친구와 같은 대학에 입학해서 너무 기뻐.,1
오늘 발표를 정말 잘한 것 같아!,1
아내가 드디어 출산하게 되어서 정말 신이 나.,1
내 주변에 부자도 아니면서 항상 돈 자랑하는 사람 정말 맘에 안 들어.,0
아내와 같이 건강 검진을 받았는데 아무 이상 없이 건강하다고 해서 만족하고 있어.,1
너는 음악 좋아하니?,1
아내의 건강이 식이요법과 꾸준한 운동이면 큰일이 없을 거라서 기뻐.,1
이번에 상견례를 하게 되었는데 예비 시부모님께서 두 분 다 친절하고 상냥하신 데다가 신세대처럼 재밌는 분들이라 너무 좋았어. 긴장하고 갔는데 너무 다행인 거 있지?,1
노후 대비가 잘한 친구들처럼 나도 말년에 여행이다 다니면서 살면 좋겠다. 걱정이야 나는.,0
은퇴를 하고 삶이 삭막할 것만 같았어. 근데 매일매일 너무 즐거운 일만 가득해서 기분이 좋아.,1
이번에 쉽지 않은 업무를 맡았는데 완벽하게 업무를 처리해서 다행이야.,1
갚을 돈은 많은데 남편이 일하다가 사고를 당해서 일을 못하게 되었어. 너무 속상하고 슬퍼.,0
남편이랑 싸우고 혼자 방안에 들어왔어. 정말 내 편은 아무도 없나 봐.,0
요즘에는 친구들을 만나도 왠지 나만 소외되고 겉도는 느낌이야.,0
이번에 아버지께서 환갑을 맞이하셨는데 친구들이 나를 많이 도와줘서 고마워.,1
내가 제안한 그룹웨어 덕분에 업무 효율성이 높아져 동료들에게 인정받게 되어 너무 기뻐.,1
안 될 줄 알았는데 다행히 이번 분기에는 목표를 달성했어.,1
기말고사가 끝나면 드디어 방학이야.,1
로또에 당첨됐어.,1
직장에 매일 같은 옷차림을 하고 간다고 주변 사람들이 수군거리며 나를 무시해.,0
나는 은퇴했어도 소일거리라도 하면서 지내고 싶은데 자식들은 일을 쉬라고 얘기하네.,1
엊그제 모임에 다녀왔는데 다들 우리 부부를 보면서 서로 닮았다고 했어.,1
회사에서 내 의견에 지지해주는 사람들이 줄어들면서 허탈해졌어.,0
요즘 몸이 안 좋아져서 돈 관리를 아내에게 맡길 거야. 내 아내는 잘 해낼 거야.,1
허리가 아파서 오래 서서 일하는 게 너무 힘들어. 그런데 사람들이 몰라주니 꼭 벌 받는 기분이야.,0
경로당의 노인들과 모두 좋은 인연이 될 수 있을 것 같아.,1
학교에 학교 폭력 전담 상담실이 만들어져 상담이 가능해졌어.,1
가족을 등한시했던 예전의 나 때문에 지금까지도 가족들과 사이가 좋지 않아 죄책감이 들어.,0
결혼을 준비하다 보니 돈 들어갈 데가 한두 곳이 아니야. 정말 놀랐어.,0
지난 달에 아우가 건강검진을 받았다고 해서 걱정했는데 결과를 보니 다행이야.,1
언니가 우울증이 있었는데 요새 표정이 많이 밝아져서 다행이야.,1
뭐가 문제일까? 연애도 결혼도 내 마음대로 되는 게 없어.,0
내가 지금은 아프지만 내 곁에 가족이 있다는 것을 생각하면 마음이 편해.,1
오빠랑 같이 도전한 영상 공모전에서 입상을 해서 기분이 너무 좋아.,1
이대로라면 돈도 다 떨어질거야. 난 왜이렇게 가난한걸까.,0
오빠 물건을 숨겨뒀는데 못 찾겠지?,0
마음이 가난한 사람을 보면 불쌍하게 생각이 드는군.,0
오늘 너무 좋은 소식을 들어서 날아갈 듯이 기뻐!,1
나 이번에 기말고사 성적 올랐어!,1
아홉 살짜리 손녀를 봐주고 있어. 두 달 됐나?,0
오늘 결혼 오 주년 되는 날이야. 내 아내에게 매우 감사한 마음뿐이야.,1
직장 상사가 자기 일까지 나한테 맡기고 있어. 업무가 너무 많아서 힘들어.,1
모아놓은 돈도 없는데 정년퇴직이 다가오니 어떻게 해야 할지 모르겠어. 미래가 불안해.,0
나이가 들어도 돈이 많아서 좋다.,1
열심히 공부했고 정확히 안다고 했던 문제가 틀려서 기분이 나쁘고 의욕이 안나.,0
친구가 하나도 없어.,0
요즘 취업난이 심각한데 무사히 취업에 성공했어.,1
나를 걱정해 주고 늘 안부를 물어주는 사람들이 있어서 정말 신뢰가 돼.,1
이제 빚은 만들지 않기로 약속했는데 남편이 또 현금서비스를 받았어.,0
노인정 사람들이 동네에서 내가 제일 건강하다고 했어.,1
내가 좋아하는 일을 찾아내서 기뻐.,1
아픈 내 곁에 남아서 온전히 나를 위해 간호해주는 남편이 너무 고마워.,1
행정고시를 준비한 지 오 년이 지났는데 아직도 합격 못하고 난 실패한 고시낭인이야.,0
어제 여자 친구랑 처음으로 파스타를 만들어 봤어.,1
회사에서 오늘부터 복지 카드가 나온대. 신난다.,1
룸메이트가 편해서 너무 기뻐.,1
아들을 위해서 뼈 빠지게 일했는데 가출을 하다니 배신당한 기분이야.,0
오늘 가족들이랑 놀이동산 가기로 했어!,1
동무들 사이에서 나 혼자 정말 힘들어는데 오늘 드디어 이 문제를 선생님께 말씀드렸어.,1
허리 디스크로 고생했는데 스포츠댄스 교실 다니면서 많이 좋아졌어.,1
조현병 환자라는 이유로 가족과 주변 사람들이 나를 점점 멀리하는 것 같아서 슬퍼.,0
어머! 나 사내 아이디어 공모전에 당첨됐대!,1
사랑한다는 말을 많이 하면 매달리는 것처럼 보일까 봐 참고 있어.,0
요즘 매일 한 시간씩 운동을 하고 있어서 내 체지방률이 많이 내려갔을 거 같아.,1
작년에 고등학교를 졸업하고 집이 어려워 대학교에 가지 못하고 취업 준비를 하고 있어. 하지만 많이 어려운 상황이야.,0
부장님은 역시 나를 알아주시는 거 같아. 내 사업 계획을 들으시고 엄청나다고 말씀해주셨어.,1
반에서 따돌림당하고 있어서 너무 우울해.,0
간호사가 보호자가 없는 나를 잘 챙겨줘서 너무 편안하고 기뻐.,1
난 웹툰 작가가 꿈이어서 그림 학원에 다니고 싶은데 부모님이 공부나 하라고 하시니까 너무 슬퍼.,0
손녀가 당뇨에 좋다고 뽑아주는 식단이 아주 효과가 좋은 것 같아 기뻐.,1
이 양반하고 이제 이혼을 했어. 이혼을 안 해야 했는데 자식들에게 잘못한 것 같아.,0
오랜만에 학교 친구들과 여행을 가게 되어서 정말 신이 나.,1
천식이 있는 나를 위해 남편이 금연해 주었어. 금연하기 힘든데 그런 결정을 내려주니 기뻐.,1
혈압약만 잘 챙겨 먹으면 여행을 가도 된다고 해서 지금 기분이 아주 좋아.,1
요즘 내 동기가 내가 어려울 때 먼저 도와줘. 정말 고마운데 내가 무얼 해줄 수 있을까?,1
학교 교수님이 일자리를 소개해주셔서 취업하게 됐어.,1
학교에서 왕따를 당하고 있어서 너무 힘들어.,0
이번에 퇴사했어.,1
다른 집 아이들은 사춘기로 자녀들과의 관계가 아주 힘들다고 하는데 우리 딸은 그렇지 않아서 다행이야.,1
이번 건강검진 결과가 나왔어.,1
생일인데 친구들이 작은 선물을 해줬어.,1
요즘 경제가 너무 안 좋아서 걱정이야.,0
며칠 전 교통사고를 당해서 심각한 트라우마가 생겼어. 밖을 나가기가 두려워.,0
치료비로 얼마 쓰지도 않았는데 모아놓은 재산을 다 써버려서 당황스러워.,0
난 이번 모임을 꼭 성사시키고 말겠어.,1
이번해에 은퇴하고 공기 좋은 곳에서 요양할 생각이야.,1
아내가 화를 내고 집을 나가서 너무 분해.,0
내 아내가 다른 남자를 만나는 것을 봤어. 나 정말 마음의 상처가 심해졌어.,0
나는 준비를 많이 했으니 이번 시험에서 만점 받을 거야.,1
직장에서의 업무량 때문에 스트레스받아.,0
은퇴하고 나니 할 일이 없고 우울해.,0
매일 한약을 먹었더니 소화불량이 많이 개선됐어.,1
내가 좋아하는 놀이공원으로 가족 모두 다녀오기로 했어.,1
이번 임시공휴일에 회사에서 쉬라고 내려와서 너무 행복해.,1
아이를 가지고 나서 밤중에 뜬금없는 음식이 먹고 싶어져. 그럴 때마다 남편이 항상 군소리 없이 먹고 싶은 음식을 사 들고 오는데 그게 참 미안하고 고마워.,1
오늘 정말 행복한 소식을 들었어. 기분이 좋아.,1
사실 나는 도벽이 있는데 친구의 이어폰을 훔쳤어. 너무 죄책감이 들어.,0
아빠의 관심 덕분에 왕따 당하는 것으로 괴로워하던 내가 이제는 친구를 사귈 용기를 얻게 되었어.,1
난 평생 젊을 줄 알았는데 왜 벌써 갱년기가 올 나인지. 건강은 또 왜 이 모양일까?,0
우리 딸이 다른 아줌마들 비해서 나만 유난히 비만인 것 같다고 말해서 열 받아.,0
딸이 공무원 시험에 합격해서 정말 기뻐!,1
진로에 대해서 잘 아는데도 불구하고 성적때문에 진학을 못한다는걸 깨닫으니 허탈하네.,0
수능 점수는 좋은데 집에 학비가 없어서 등급이 낮은 학교에 입학해야 할 거 같아.,0
이번에 새로 온 팀장님이 날 너무 싫어해서 큰일이야.,0
저 친구보다 친화력이 부족하다고 생각하고 있었는데 알고 보니 친구들이 나를 피했던 거라 속상해.,0
남자친구가 갑자기 헤어지자고 했어.,0
퇴직 후 수입이 없어지니 경제적으로 어려워. 생계가 막막하고 걱정이 돼.,0
친척들 모임에서 성적 이야기가 나온 후로는 부모님이 모임에 나를 데리고 가지 않으셔. 너무 속상해.,0
금일 시험 무척 잘봤어. 내가 아마 젤 잘본 것 같아!,1
나 얼마 전에 결혼했어.,1
집 장만도 해 두었고 아이 대학 등록금도 준비해 두었고 아직 부족하지만 노후 준비가 잘 되고 있다고 생각하니 마음이 든든해지네.,1
이제 병이 다 나아서 치료 안 받아도 된다고 하니 너무 편안한 기분이야.,1
요즘 새로운 친구를 사귀었는데 중학생 이후로 정말 잘 맞는 친구를 만나게 되어 너무 기뻐.,1
요즘에 자신감을 많이 잃은 것 같아.,0
천식을 한평생 달고 살았었는데 뉴스를 보니 천식 치료제가 개발되어서 기뻐.,1
내 또래 친구들이 건강을 위해서 영양제를 먹는 줄 몰랐어. 너무 당황스러워.,0
직장동기들이 내가 가난하다는 걸 알고 불쌍히 여기네.,0
손녀가 내 안위를 자식보다 많이 걱정해주는 것 같아 고마워.,1
내성적인 성격 때문에 친구가 없었는데 수학여행에 같이 다닐 친구가 생겨서 너무 기뻐.,1
부모님이 너무 언니만 좋아하는 것 같아 질투나.,0
부모님이 돌아가신 날은 나와 별로 친하지 않았던 사람들까지 와줘서 위로가 됐어.,1
아내가 곧 출산한다고 연락이 와서 두근두근하고 긴장되네.,1
남편이 약속을 어기고 내게 또 거짓말을 해서 배신감을 느껴.,0
내 나이가 백세인데도 잘 먹고 잘 걸어 다니고 있어.,1
퇴사 후에 집에서 놀던 남편이 정신 차리고 일을 나가서 안심이야.,1
몸이 쇠약해서 병원에 가고 싶었지만 돈이 부담이었는데 딸이 보내줘서 고마웠어.,1
내가 기립성 저혈압이 있어서 일어날 때 마다 어지러워서 방문을 잡고 있었는데 아내가 나더러 엄살을 피우지 말라 하네.,0
오늘 기말고사 결과 나왔어.,0
우리 동네 노인들은 서로 친해. 필요하다면 서로 어떻게든 도우려고 해.,1
느닷없이 친구들이 날 따돌려서 당혹스러워. 내가 무슨 잘못을 한 걸까?,0
이십 대에 노후 계획을 잘 세워놓은 덕에 사십 대가 한결 편해.,1
친구가 동생이랑 너무 안 닮았다고 하는데 이 상황을 어디서부터 설명해야 할지 모르겠어.,0
형이 내가 늦게 들어온 걸 엄마한테 일러서 너무 화가 나.,0
이번에 토익 스터디 그룹을 시작하게 되었어.,1
오늘 여자친구에게 줄 반지를 잃어버릴 뻔했어.,1
휠체어를 타고 버스를 타야 하는데 거부당했어. 너무 슬퍼.,0
쉬는 시간마다 괴롭힘당하지 않도록 선생님이 오셔서 감시해주셔서 너무 안심돼.,1
오늘 크리스마스인데 아들에게 선물을 사줬는데 너무 좋아해.,1
회사에서 진급하기 위해 동료들과 경쟁을 하는데 동료들과 경쟁을 해야 한다는 사실이 슬퍼.,0
나이가 들어서 몸도 예전 같지 않고 얼굴도 주름져 가고 있어.,0
내가 재테크를 하고 싶은데 뭐가 뭔지 모르겠어. 뭐부터 시작하라는 건지도.,0
오늘 집에 데려온 친구가 있는데 엄마가 만족해하는 눈치였어.,1
이번에 기말고사에서 일등을 할 수 있을 것 같아.,1
성적이 잘 나와서 엄마가 뮤지컬 보는 것을 허락해주셨어!,1
회사 일이 너무 힘들어.,1
내 교우관계 때문에 가정에 많은 불화가 생겨.,0
우리 남편에겐 정말 고마워. 애 낳고 나서 남편이 애를 너무 열심히 돌봐주고 있거든.,1
업무 실수로 회사에 손해를 입혔어.,0
이제 은퇴하면서 아무 쓸모 없는 사람이 되었어. 불행한 늙은이야.,0
오늘까지 처리해야 하는 팀 프로젝트 보고서 때문에 동료에게 문자를 보냈는데 답장이 안 와 미치겠어.,0
부모님이 이혼할 것 같았는데 다행이다.,1
좋은 기회가 생긴 것 같아. 다 상사님 덕분이야.,1
요즘 남자친구가 연락이 뜸해.,0
아내는 병상에서 움직일 수가 없고 나는 병원비를 벌어야 하는 상황이라 너무 슬퍼.,0
아빠가 퇴근하시면서 선물을 사오셨어. 너무 신이 나.,1
얼마 전 새로 사귄 친구에 대한 나쁜 소문이 사실이 아니라는 걸 알게 돼서 안심했어. 친구도 많이 놀랐을 텐데 내가 그 친구의 마음을 위로해 주고 싶어.,1
부모님만큼 믿음이 가는 사람들도 없어.,1
언니와 오빠가 오늘 생일이라고 용돈도 주고 선물도 줬어.,1
왜 자꾸 옆집이랑 비교해 가며 재산의 규모를 이야기하는지. 자식들이 이럴 땐 참 미워.,0
내 친구 미나 있잖아. 그 애가 도와줘서 날 괴롭히던 애들이 더 이상 못살게 굴지 않게 됐지 뭐야.,1
친구들이 나 없는 자리에서 내 욕하는 걸 우연히 들었어. 기분이 매우 안 좋다.,0
오늘 무슨 날인지 알아?,1
이혼한 친구가 다녀갔어.,0
나 오늘 회사에서 표창장 받았어. 정말 신이 나.,1
상사에게 애교를 부리며 아첨하는 직장 동료가 너무 징그러워 보여.,0
다시 취업해서 안정적인 수입이 생긴 것이 기뻐.,1
오늘 새로운 모임에 나갔어. 기분이 좋아.,1
친구들이 무슨 일이든 도와주겠다고 했어. 그래서 지금 매우 기뻐.,1
내가 몸이 아파서 병원에 있는데 손녀의 결혼식에 갔다 와도 된다고 의사 선생님이 말하시네.,1
내가 유행성 독감에 걸려서 나만 김 씨 생일잔치에 초대받지 못했어.,0
아내가 방광염 치료를 받고 나서 이제 밤중에 화장실을 가느라 날 깨우지 않아.,1
나는 맨날 아프기만 하고 한심한 쓰레기야.,0
종양이 악성이 아니라 너무 기분이 좋아.,1
나 오늘 생일이잖아. 딸 때문에 정말 기분이 날아갈 것 같아.,1
이번에 내가 로또에 당첨됐어.,1
남자친구랑 결혼 문제에 대해서 천천히 생각해보기로 했어.,1
오늘 처음 거래처와 미팅 갖기로 했어.,0
나는 이 사람을 상처주지 않았는데 선생님은 내가 주동자인 줄 알아.,1
소득수준이 낮은데 생계 부양에 대한 부담이 너무 커서 슬프고 도움 요청할 사람이 없어 서러워.,0
딸이 어릴 적에 한 번 크게 아팠었는데 건강하게 잘 자라서 이제 결혼까지 하게 됐어. 정말 감사한 일이야.,1
이번에 결혼식을 하게 되었는데 생각하지도 못한 친구가 축하한다고 연락을 했어.,1
전엔 안 그러더니 요즘 왜 그러나 몰라!,0
나 부모님께 너무 죄송해.,0
십 년 동안 꾸준히 모든 돈을 사기로 잃었어.,0
잃어버렸던 강아지를 찾았어.,1
나는 정말 다 가진 인생을 산 거 같아.,1
나 취업했어! 너무 원하던 곳이라서 기대된다.,1
수많은 시간을 보낸 회사에서 해고를 당했어. 현실을 믿고 싶지 않아.,0
남편이 내 돈을 들고 집을 나갔어. 어떡하지?,0
동생이 심장마비로 쓰러졌는데 조금만 늦었어도 큰일 날 뻔했어.,1
가해자의 아빠가 부모가 없으니 그 모양이라며 나를 비하하는 말을 했어.,0
노후 대비를 하나도 안 한 내 자신이 너무 한심해.,0
회사 동료 때문에 기분이 안 좋아.,0
대형 프로젝트가 끝나고 업무량이 줄어들어 이제야 좀 느긋하게 일 할 수 있어.,1
요즘 사춘기인지 애들이 대화도 회피하고 말도 안 듣고 너무 속상해.,0
아우도 나도 이번에 기말고사 시험을 잘 봤어.,1
사업을 하다 난처한 상황에 이르렀는데 지인이 도와줘서 고비를 넘겼어.,1
