text,label
남편이랑 지금처럼 아프지 않고 오래 살았으면 좋겠어.,1
친구들이랑 다른 지향점을 가진 걸 알게 됐는데 나보고 이상하고 잘못된 거라 그래서 속상해.,0
난 은퇴를 하고 싶고 남편은 일을 더 하고 싶어 하지만 우린 서로를 존중해서 마음이 편안해.,1
면접을 너무 잘 봐서 무조건 합격일 줄 알았는데 탈락했어.,0
퇴원 후 처음 맞이한 명절인데 자식들은 보러 오지도 않았어.,0
나 직장 상사랑 싸웠는데 정말 싫어.,0
남편이 내가 암이 나을 때까지 옆에서 병간호해 주겠대.,1
이제 직장에서 완전히 자리를 잡아서 마음이 참 편안해.,1
직장에서 정말 고마운 일을 겪었어.,1
유능한 신입사원이 와서 너무 기분이 좋고 뿌듯해.,1
내 몸도 안 좋은 판에 남편도 자꾸 아파서 수발이 한도 끝도 없으니 어떡하지? 설상가상이라는 말은 이럴 때 쓰는 말이 아닌가 싶어.,0
드디어 내 꿈을 찾았어. 나는 사람들을 도와주는 일이 너무 좋아.,1
나 오늘 황당했네.,0
학교 폭력을 당하고 있었는데 선생님께서 그걸 먼저 알아채고 도와주셨어.,1
아이들이 다 커서 이제 자기들이 할 수 있는 일들을 찾아서 하고 있어.,1
우리 집이 가난하지 않았다면 좋았을 텐데 라는 생각이 자주 들어서 마음이 아파.,0
아들에게 유산을 미리 준다고 생각하고 아파트를 물려줬는데 말도 없이 팔아버려서 화가 나.,0
내 환갑을 기념해서 자식들이 천만 원을 선물해줬어.,1
나이도 먹고 교육도 못 받아서 퇴직을 당했어. 조금이라도 젊었을 때 열심히 할걸.,0
결혼 준비하는데 말도 못 하게 힘드네. 서로 집안이 다르니 서로 맞추는 게 너무 어려워.,0
아빠는 주말마다 맛있는 요리를 해주셔서 너무 좋아.,1
회사에서 은퇴를 은근히 압박하는데 해고를 당할까 봐 전전긍긍하는 내가 한심해.,0
나 이번에 취업 성공해서 너무 만족스러워.,1
나는 왜 언니보다 잘할 수 없는 걸까? 언니랑 항상 비교당해서 짜증 나.,0
나 기분이 안 좋아.,0
내가 실수해서 회사의 신제품이 노출돼 버려서 죄책감이 들어.,0
이번에 여자친구가 나에게 프러포즈를 했어!,1
나와 내 동생이 배다른 형제래. 정말 혼란스러워.,0
엄마는 내가 뭘 하겠다고 하든지 승낙해주셔.,1
몸이 아프니까 일할 수 있는 곳도 없네.,0
퇴직 후 쉴 틈도 없이 남편이 구직하라고 매일 성화니 성가셔 죽겠어.,0
난 예전엔 대인관계가 참 어려웠는데 직장생활을 하고 난 이후부터는 많이 편안해졌어.,1
나 임신한 것 같아! 어려운 시기에 아이가 찾아와줘서 너무 설레어!,1
퇴근 후에 아내와 같이 헬스장 다닌 지 삼 개월 정도 됐는데 꾸준히 하는 게 힘들면서도 보람은 있어.,1
오늘 우리 형이 좋은 대학에 붙었어. 너무 기뻐.,1
회사를 그만두고 셰계 여행을 가고 싶어.,1
병원에 갔더니 간호사가 이렇게 건강하고 몸 좋은 할아버지는 처음 본대. 너무 신나.,1
이번 소개팅에는 정말로 잘 맞는 사람을 소개받았어. 연락도 자주 해.,1
친구가 퇴원해서 너무 좋아.,1
스펙 좋은 후배들에게 밀려 자리에서 물러나게 됐어. 내가 고졸 출신이라 이렇게 됐나 봐.,0
매일 하루를 무기력하게 보내고 있을 바에 빨리 세상을 뜨는 것이 나을 것 같아.,0
오늘 건강검진 결과 나왔는데 지난번 보다 간 수치가 좋게 나왔대.,1
친구들이 내가 성적이 낮아서 내 이야기를 잘 안 믿어. 너무 기분이 나빠.,0
친구들이 성적이 나보다 더 좋아서 조급했는데 엄마가 그런 마음을 딱 알고 조언해 줘서 기뻤어.,1
손녀가 휴가를 받고는 내내 내 말동무도 해 주고 간별도 해 줬어.,1
연애의 마지막이 결혼인 걸까?,1
내가 꼴 보기 싫다며 같이 살던 집에서 쫓겨나서 너무 혼란스러워.,0
회사가 나를 기계 부품처럼 가차 없이 교체한다는 걸 느껴서 너무 슬퍼.,0
오늘 친구들한테 맞아서 너무 속상해서 형한테 말했더니 형이 혼내주러 갔다 왔어.,1
부동산 중개인이 나에게 수익이 되는 물건을 소개해줄 것이라고 믿어.,1
내일이면 마지막 출근이야. 은퇴라니 믿기지가 않아.,1
상사가 말하기 싫은 가정사를 계속 공개적으로 이야기해. 너무 스트레스 받고 상처받아.,0
옆집 학생의 생각을 하면 정말 마음이 아파.,0
친구가 날 죽일 것만 같아. 친구와 사이좋게 지낼 수가 없어.,0
남편이 내 직장이 찾아오더니 난동을 부리고 갔어. 충격적이야.,0
젊을 때도 우울증이 있어 휴직을 많이 했었는데 이제는 좀 심한 것 같아 퇴직 후에는 아무것도 안 해.,0
이번에 우리 팀의 아이디어가 채택될 거야.,1
어머니가 이제 내 세뱃돈을 대신 관리해주신대.,0
엄마가 내가 가지고 싶던 물건을 사주신대!,1
직장에서 사람들이 내가 굉장히 젊어 보인다고 해. 동갑내기 동료는 오십견이랑 노안 때문에 힘들다고 하는데.,1
다이어트해서 십 킬로그램이나 체중을 줄였어.,1
오늘 면접 결과가 나왔는데 불합격이래. 이번이 세 번째야.,0
좋아했던 사람이 드디어 고백을 받아 줬어.,1
위 절제술을 받으러 들어가는데 아내가 손을 꼭 잡아줘서 마음이 편안했어.,1
건강에 대해 혼란스러워.,0
말에 상처를 잘 받아서 사람 만나는 게 두려워.,0
지금 여자친구랑 연애하길 잘한 거 같아.,1
천식이 있는 나를 위해 남편이 금연을 해주었어. 금연하기 힘든데 그런 결정을 내려주니 기뻐.,1
학업 계획서를 아직도 못 냈는데 선생님한테 불려갈 것 같아서 불안해.,0
대출을 받아야 하는데 역시 제일 금융권이 안전한 거 같아.,1
남자에게 늘 당하면서 남자 없이는 못 사는 친구에게 잔소리하려고 해.,0
노인정에서 알게 된 사람들이 요통에 좋은 찜질 방법을 알려줘서 그대로 했더니 많이 편안해졌어.,1
나는 아무리 생각해도 빵을 만드는 게 나의 천직인 거 같아.,1
우리 반 반장한테 자꾸 질투가 나서 견디기 힘들어.,0
내 회사는 납기일이나 입금일을 밀린 적이 없어 거래처에 신용도가 좋아.,1
힘들때 도와주는 친구가 있다는건 정말 복받은거라 생각해. 나에게는 그런 친구가 있거든.,1
박내과에 새로운 간호사가 약 설명도 잘해주고 친절하고 싹싹해서 마음에 들어.,1
남의 시선으로 인해서 정말 스트레스 받는 일이 있었어.,0
여태껏 살면서 별로 감사할 줄 몰랐는데 요즘은 살아있는 것 자체가 감사하는 마음이 드네.,1
코로나 때문에 취업이 어려운 시기지만 다행히 취업에 성공했어.,1
나 이번에 오랫동안 준비하던 시험에 합격했어. 정말 기뻐.,1
학교에 가면 그냥 심심해서 유약해 보이는 벗을 괴롭히고 있어.,0
아 편하다. 기분 좋아.,1
노후를 위해 열심히 저축하고 투자한 덕분에 지금 여유롭게 지낼 수 있는 것 같아 만족스럽고 기뻐.,1
드디어 퇴원이라니! 믿어지지 않아.,1
진짜 피곤하고 성가셔.,0
친구들 때문에 화가 나.,0
평소에 나를 무시하던 내 동생이 대기업에 취직했대. 내가 동생보다 진짜 부족한 사람이 된 것 같아.,0
실적을 보고 이제야 내가 이렇게 한심한 사람인지 알았어.,0
우리 집 고양이가 죽었대. 엄마한테 들었을 때 너무 놀라서 믿을 수가 없었어.,0
나이가 들다보니 아내와 자녀와의 관계 너무 안좋아서 외로워.,0
명절만 되면 집에 가기 싫어. 나만 보면 취업 언제 할 거냐고만 물어보니까 짜증 나.,0
여자친구와 결혼을 하고 싶은데 아직 말을 못 하겠어. 조심스러워.,0
오늘 내 생일이라고 남편이 예쁜 꽃다발을 준비했네. 너무 기분 좋아!,1
아내가 허리 수술을 받느라고 꼼짝도 못하다가 이제 서서히 움직이니까 너무나 좋아.,1
부녀지간에 사이가 좋아서 정말 감사해.,1
경쟁 사회에서 살아남기 너무 힘들어. 믿어준 사람들한테 좋은 결과를 못 줘서 죄책감이 들어.,0
우리 딸이 요새 기특한 짓을 했어.,1
부모님이 학교 성적에 크게 연연하지 말라고 하셨어. 부모님이 그렇게 말하시니 기뻐.,1
사랑하는 아내가 세상을 떠나서 이루 말할 수 없이 슬퍼.,0
우리 딸은 날 더 좋아해.,1
꼭 제 시간에 먹어야 하는 혈압 약을 잃어버렸는데 아내가 챙겨놨어 다행이야 감사해라.,1
오늘 가족들과 한강 공원에 소풍을 갔어. 오랜만이라 너무 신났어.,1
출산을 하고 육아를 시작한 후 나 자신을 잃어버린 것 같아서 슬퍼.,0
이번 달 중학교 동창 모임 있는데 나가야 할지 고민이야.,0
취업에 성공해서 모든 일에 정말 감사한 마음이야.,1
오늘 어머니가 쓰러지셔서 많이 걱정됬는데 신경성위염이었어. 큰병인 줄 알고 놀랐는데 안심이야.,1
이번 은퇴는 너무 억울해.,0
나와 남편은 서로를 믿기 때문에 절대 잔소리를 하지 않아.,1
몸이 안 좋아서 병원에 갔는데 단순 감기로 나왔어.,1
스터디 때문에 학원 다니고 싶은데 말하기가 조심스럽네.,0
요즘 우리 딸 때문에 속상해. 예전엔 나랑 얘기도 잘하더니 이제는 싫다고 해.,0
오늘 가족회의를 했어. 재밌는 시간이었어.,1
다리가 아픈 아내에게 줄 지팡이를 깎고 있는 지금 이 순간이 소중해.,1
결혼을 하고 나니 생활이 더 안정감 있는 것 같아서 너무 좋아.,1
내가 얼마 전에 독감에 걸렸었어. 그래서 가족들에게 옮을까 걱정이 많았는데 옮기지 않아서 너무 다행이야.,1
점점 복약하는 약이 늘고 있어.,0
나 오늘 옆집 할멈에게 오백만 원을 건네주고 왔어. 내 스스로가 자랑스러워.,1
친구가 아내 병원비 때문에 고생하는 것 알지만 빌려주는 게 어렵네.,0
딸이 취직했어. 정말 기뻐.,1
부모님이 어제도 많이 다투셨어. 내 학원비 때문에 싸운 것 같아서 너무 속상해.,0
직장을 구하지 못해서 자꾸 부모님 눈치가 보여.,0
오늘 병원에서 정말 기분이 좋은 일이 생겼어!,1
요즘 가족관계가 정말 좋아 마음이 느긋해.,1
혈압이 높아 약을 안 먹으면 죽는다지만 난 약 먹기가 너무 싫고 늙어서 온몸이 아파.,0
오늘 긴장했던 결혼식을 무사히 마쳤어. 안도감이 들어.,1
자식들이 결혼을 하고 가정이 생기니 타인이 된 것 같다.,0
노인의 건강을 위한 정책이 많이 생겨서 다행이야. 참 감사해.,1
노후 준비가 완벽해서 직장에게 감사해.,1
어제 친한 친구를 만나서 너무 기뻐.,1
가난에서 벗어나고 싶은 갈망이 너무 커. 너무 속상해.,0
오늘은 야근이 없어서 좋았어.,1
부모님으로부터 독립을 해야 하지만 아직도 못하고 있어 난 너무너무 한심한 것 같아.,0
괴롭히던 아이들에게 말을 걸었는데 괜찮았어. 그래서 기뻐.,1
내가 믿고 투자했던 김 사장의 사업이 크게 성장해서 기뻐.,1
내 직장에서 연봉이 올랐어.,1
나 진짜 가고 싶었던 회사에서 합격했다고 연락이 온 거 있지?,1
이번에 다행히 완치 판정을 받아서 아내의 마음이 조금이나마 편안해진 것 같아.,1
누나가 시험을 봤는데 한 문제 차이로 아슬아슬하게 합격했어. 합격해서 다행이야.,1
선생님께서 내가 괴롭힘 당하는 것을 처리해 주시겠다고 하셨어.,1
부모님의 간섭 때문에 울었어. 뭐든 다 내 우울증 때문이라 치부해버리셔서 슬퍼.,0
내가 기억력이 안 좋아져서 대화가 힘드니까 사람들이 대화를 기피해.,0
우와. 선생님 짱이야. 선생님하고 상담했더니 그동안 애들로부터 당했던 어려움을 다 해결해주셨지 뭐야.,1
내가 다른 사람들보다 정신적으로 부족해서 부모님이 이혼하신 거 같아서 힘들어.,0
당뇨가 있어서 매일 운동을 해야하는데 함께 운동 해 주는 동네 언니가 있어서 너무 좋아.,1
부모님이 취직 언제하냐며 나를 비난하시는데 난 다시 하고 싶지 않아.,0
요즘 취업이 잘 안 된다 해서 너무 두려워.,0
지금 이 나이에 직장을 다닐 수 있는 거에 정말 감사해.,1
큰 손주가 좋은 회사에 취직했대. 정말 기분 좋아.,1
사춘기인거 알면 나 좀 내버려두지. 꼭 무슨 여행갈때 같이 데려가려고하네.,0
이번 추석 휴가비가 많이 나왔어.,1
종양을 없애겠다고 몇 년을 노력했지만 결국 악성종양으로 발전했어. 정말 허탈해.,0
내가 지금 나이가 있지만 건강해서 감사해.,1
내가 다니는 회사는 직원들을 위한 복지는 없으면서 주어지는 업무만 과중해.,0
남들보다 갱년기가 빨리 왔어. 난 이제 여자로서 끝났구나 싶어서 괜히 열등감 느껴지네.,0
친구 관계가 어려워.,0
한 달 동안 기획한 사업을 팀원들과 협력해서 성공적으로 끝나게 됐어.,1
아내가 자꾸 적게 먹으라고 해서 힘들긴 한데 확실히 속은 편해지네.,1
사람을 대할 때의 태도가 예전과 많이 달라졌음을 느껴.,0
이제 나이도 나이인 만큼 은퇴를 해 볼까 해.,1
빵집을 열 수 있을 만큼의 돈이 모여서 퇴직했어.,1
드디어 신규 계약 체결에 성공했어!,1
지금 많이 속상한 일이 있는데 같이 술 한 잔 마실 만한 친구가 없어.,0
요즘들어 남편이 집에서 급격히 말이 없어져 불안해.,0
우리 남편은 정말 좋은 남편이야. 항상 일찍 퇴근해서 아기에게 책을 읽어주고 있다니까.,1
유학을 갔다 온 딸이 대기업에 취업을 해서 기뻐.,1
친구의 조언에 따라 이번에 질병 보험금을 투자하기로 결정했어.,1
이혼 후 몇 년 만에 사랑하는 사람이 생겨서 재혼했어.,1
이번에 장기근속으로 꽤 큰 상을 받았어.,1
친구들과 한강에 가서 치킨과 맥주를 마셔서 느긋하고 좋았어.,1
입사 합격 문자가 사실은 시스템 오류로 잘못 전송된 것이었어. 너무 비통해.,0
친구들이 내 성격을 걱정해.,1
애인이 험담 하는 거 남 얘기인줄 알았는데 내가 그럴 줄은 몰랐어. 이제야 깨달은 게 한심하다.,0
내일 결혼인데 비가 엄청 많이 온대. 하객들이 많이 안 오면 어떻게 하지?,0
얼마 전 건강 상태를 알게 되었는데 내가 아프면 모든 걸 스스로 해야 되는 자녀들이 걱정돼.,0
내가 주먹을 휘두르니까 괴롭히던 애들이 도망갔어. 이제 자신감이 생겼어.,1
언니는 항상 예쁜 옷만 입고 내 옷은 촌스럽기만 해.,0
아내와 같이 자는 게 싫어서 거실에서 자는데 이 일도 반복되니까 화가 나.,0
병원에 갔더니 간암이래. 진작 아내 말을 들을 걸 후회하고 있어.,0
이번에 과장으로 승진했어.,1
오늘 슬픈 일이 있어.,0
어제 건강관리 하라는 충고를 들었는데 꼭 그럴 필요 있을까 싶어.,1
친구들이 나를 더 이상 왕따 안 시키고 놀아주기 시작했어.,1
건강이 안 좋아져서 예후가 좋지 않다고 하네. 자녀들을 힘들게 할까 봐 이런 내가 너무 싫다.,0
남편이 회사에서 바람을 피운다는 게 잘못된 정보라서 안심이야.,1
결혼 삼 년 차인데 아내가 매일같이 잔소리만 해. 내가 아내랑 사는 것인지 엄마랑 사는 것인지 모르겠어. 내 물건 작은 것 하나만 사도 난리도 아니야.,0
내가 왜 언니 때문에 결혼을 미뤄야 하는지 모르겠어.,0
엄마는 분명 날 자랑스러워 하실꺼야.,1
이제 곧 퇴직인데 걱정이 많아.,0
남편 사업이 갑자기 부도나서 미국에 유학 중인 아들에게 부칠 돈이 하나도 없어 걱정이야.,0
기말 성적 오르면 용돈 올려주신다 해서 커닝을 했어. 그런데 그걸 친구가 본 거 같아.,0
동생이랑 냉전 상태였는데 다행이네.,1
요새 허리가 아픈데 아내가 돈 벌어오라 잔소리를 해서 자꾸 상처 받아.,0
노트에 숙제를 했는데 자꾸 훔쳐 가서 베끼는 애가 있어. 화가 나.,0
아이들이 모두 대학에 가게 돼서 좋은 일이지만 적금을 깨야 할 것 같아 힘들어.,0
늙어서 말이 잘 안 나오니까 소외되고 외로워.,0
아들이 퇴원하는 날에 내 병이 완치 된 것이 아니라고 말해서 두렵고 혼란스러워.,0
내가 병에서 완쾌하고 퇴원하니 아내가 이혼하고 싶다고 해서 속상하고 혼란스러워.,0
대인 관계에 흥분돼.,1
이번 모임은 정말 잘 된 거 같아.,1
회사에서 내 의사를 굉장히 잘 반영해줘서 신이 나.,1
같이 근무하는 직장 동료 때문에 너무 배신감이 들어.,0
이번에도 월세를 못 내면 쫓겨날 것 같아서 너무 불안해.,0
직장 상사가 날 악의적으로 괴롭히는 것 같아.,0
주변 사람들이 나더러 멋쟁이 할머니래.,1
결혼 후 남편과의 대화 단절로 슬프고 힘에 겨워.,0
자폐증이 있는 날 과잉보호로 키우셨는데 고마움을 느끼지 못해서 부모님께 죄책감이 들어.,0
항상 내가 앉은 도서관 양옆은 비워져있어. 너무 속상해.,0
이번 프로젝트는 성황리에 잘 마무리될 거라고 생각해.,1
중간고사를 위해 정말 열심히 공부했는데 아빠가 칭찬 한마디도 안 해주셔서 화가 나.,0
내 항암 치료를 계속 지원해 주는 동생의 우애는 세상에서 제일 가는 게 분명해.,1
요즘 힘들다.,0
우리 반에는 왕따 주동자가 한 명도 없어서 되게 좋아.,1
친구가 매일 나에게 전화해서 본인 이야기를 늘어놓아 전화 받기 짜증 나.,0
내가 사랑했던 친구들이 더는 나를 사랑하지 않는 것 같아. 이제 나의 삶의 의미는 어디서 찾을 수 있을까?,0
내가 좋은 사람이라고 결혼을 잘한 거 같다는 아내의 말에 눈물이 났어. 고생만 시킨 거 같아 눈물이 나.,0
왜인지 모르겠는데 어느 날 갑자기 반에서 내가 왕따가 되버렸어.,0
다들 취업 때문에 정신없어 보여.,1
연애시절 때부터 아픈 나 간호하겠다고 고생한 우리 남편이 되레 암에 걸렸어.,0
오늘 수능결과가 나왔는데 성적이 잘 나왔어.,1
아내만큼 음식을 잘하는 사람이 없는 것 같다고 자신해.,1
이번에 이직한 회사의 복리후생 제도가 너무 좋아서 마음에 들어.,1
지난번 관절염으로 고생할 때 계단에서 짐을 들어줬던 청년을 옆집에서 다시 봤는데 너무 반갑더라고.,1
아이들 대화를 따라갈 수가 없어 나도 나이가 먹었나 봐.,0
몸이 안 좋아서 제대로 취업 준비도 못 하고 고민이 많아.,0
갑자기 부모님이 나의 학업에 신경을 쓰기 시작했어.,0
중년에 벌써 몸이 아프니 혼자 고립된 느낌이야.,0
직장을 그만두고 친구들과 느긋하게 여행을 다니고 있어.,1
회사에서 너무 많은 업무에 시달려서 이제는 진짜 가기가 싫어졌어.,0
나는 지금이 내 인생에서 제일 행복한 것 같아.,1
나는 직장에서 뛰어나다고 자신할 수 있어.,1
결혼하기로 약속한 남자가 있는데 그쪽 집안에서 나를 반대해.,0
부모님이 성적표를 보실까봐 두려워. 이번에 성적이 무척 많이 떨어졌거든.,0
내가 허리가 아파서 김 씨가 대신 밭을 갈아주기로 했는데 아직도 나오지 않았어. 나오지 않으면 어떡하지.,0
이직을 원했지만 갖은 사유로 나를 붙잡던 회사에서 확실히 퇴사 결정이 나서 마음이 한결 편안해,1
남편 핸드폰을 우연히 봤는데 세상에 나 몰래 어떤 여자랑 채팅하고 있더라. 입에 담기도 더러운 말들을 주고받고 있더라고.,0
우리 부모님이 나를 사랑하는지 모르겠어.,0
애들이 나를 괴롭혀. 너무 힘들어.,0
학교를 이제 졸업하는데 정말 보람차게 학교를 다닌 거 같아서 뿌듯해.,1
나는 수학을 매우 잘해. 나는 뛰어난 수학자가 될 거야.,1
결혼을 못 할 줄 알았던 딸이 드디어 좋은 사람을 만나 결혼하게 되어서 정말 안심이야.,1
친구와 심하게 싸웠어. 다 나 때문인 것 같아.,0
난 절대음감이 있어서 피아니스트가 되고 싶어.,1
옛날에 친했던 친구가 있는데 그 친구가 나를 이용했어. 너무 어이없고 배신감을 느껴.,0
요즘 세상에 성 정체성이 모호하면 직장을 구하기 어려운 것 같아.,0
아니 요즘 젊은이들은 왜 그러는거야.,0
예전에 아이 문제로 고민이 많았었는데 이제 편안해졌어.,1
오랫동안 짝사랑 해오던 친구와 사귀게 되었어.,1
오늘 내가 앞이 잘 안 보이는 걸 하마터면 며느리에게 들킬 뻔해서 마음을 졸였어.,0
이번 시험도 못 봐서 죄책감이 들고 부모님께 너무 잘못한 것 같아.,0
졸업 후 정신 없이 취업 준비를 해야하는데 부모님의 지원 덕에 마음이 편하다!,1
나이를 먹으니 안 아픈 곳이 없어서 걱정이야.,0
내가 보니 건강한 사람들의 공통점은 마음이 평온한 거에 있는 거 같아.,1
이제 이 학교에 학교폭력 가해자들이 없어서 너무 좋아.,1
아이가 컸다고 방에만 있고 나오질 않네. 조금 외롭군.,0
오늘 내 생일이었는데 부모님이 내가 싫어하는 음식을 사 오셔서 당황했어.,0
내가 병원비만 많이 들지 않았어도 김 할머니보다 부자였을 거야.,0
당뇨 수치가 높게 나와서 걱정되는데 옆에서 친구가 밥이랑 약 잘 먹으면 괜찮은 거 아니냐는데 좀 화가 났어.,0
요즘 코로나 때문에 자주 못 만나고 단톡방 대화를 많이 하는데 오히려 더 친구들 사이가 좋아진 느낌이야.,1
철민이랑 건강검진을 받으러 갔어.,1
오늘 건강검진을 받았는데 예전보다 건강이 좋아졌대.,1
요번에 시험 점수가 잘 나와서 만족해.,1
상견례 후 우리는 곧장 결혼식 날짜를 잡기로 했어.,1
당장 다음 학기 등록금을 마련해야 하는데 부모님이 곧 이혼하실 것 같아.,0
이번 보너스가 삼백 퍼센트 나온다고 온 직원들이 신이 났어.,1
나는 내 주변 사람들을 믿어.,1
내 비서가 오늘 회사에서 엄청난 실수를 해서 막대한 손실을 보았어!,0
골프 동호회에서 젊은 사람들이 나를 왕따시키는 것 같아 서글퍼.,0
아들이 한 번도 빠짐 없이 다달이 용돈을 보내줘서 기뻐.,1
은퇴 후 앞으로 어떻게 해야될지 막막하던 참에 아들은 내가 집에서 놀기만 한다고 핀잔을 주었지뭐야.,0
드디어 친구와 화해했어!,1
부모님이 선뜻 내가 가고 싶은 고등학교를 갈 수 있게 지원해주셨어.,1
학교폭력 피해학생이 심하게 맞고 있는데 내가 해 줄 수 있는 게 아무것도 없어.,0
골반 운동을 쉬면 온 몸이 뻐근하고 붓는 것 같아.,0
요즘 퇴근하고 너무 우울하네.,0
요즘에 전화가 오면 불안해. 별로 통화하고 싶지 않고 문자만 하고 싶어.,0
남편이 치매에 걸려서 어제 일을 기억하질 못해. 너무 절망적이야.,0
취업이 고민이었는데 최근에 취업 멘토 프로그램을 알게 돼서 다행이야.,1
정말로 친한 친구가 이번에 결혼한다고 하는데 아주 기뻐.,1
부모님이 물려주신 땅을 팔지 않고 놔두었는데 최근 땅 값이 크게 올라 돈을 벌게 되었어.,1
뒷바라지해 준 것도 없는데 혼자서 사법고시에 합격한 아들에게 정말 감사해.,1
여태 이해 못하고 있던 수학 개념에 대해 드디어 이해할 수 있게 됐어. 정말 기뻐.,1
내 잘못으로 이혼을 생각하고 있어.,0
오늘 회사에서 다른 상사와 싸워서 홧김에 그만둔다고 해버렸어. 어떡하지?,0
친구가 얼마 전에 내 욕을 한 걸 알게 되었어.,0
오늘 평생 다니던 직장에서 퇴직했어. 오래 다녔는데도 보람이 없고 후회만 되네.,0
그 친구를 믿고 투자를 했는데 노후 걱정 없을 만큼 벌어서 너무 기뻐.,1
남편이 이번에 진짜 금연을 하겠다고 해서 한 번 믿어보려 해.,1
합격 연락이 왔는데 사실 내가 다니고 싶은 회사는 아니어서 지금 고민이 돼.,0
남자친구랑 오랫동안 연애를 했어. 이 사람이라면 믿고 결혼할 수 있겠어.,1
어제까지 크게 싸우던 부모님이 이제 화해를 해서 다행이야.,1
나도 폐경이 왔어. 남에게 말하기가 부끄러워.,0
어제 가볍게 복권을 샀는데 오만 원 당첨이 됐어.,1
노후에 좋은 친구들이 주변에 있어서 안도감을 느껴.,1
퇴직금을 받았다는 소식을 어떻게 들었는지 다단계에 빠진 친척이 연락했어.,0
날 따돌렸던 애랑 다른 반이 돼서 너무 행복해.,1
결혼한 딸이 이번에 용돈을 올려줘서 고마워.,1
내 친구들이 진짜 착하고 너무 좋은 덕분에 학교생활이 더 재미있는 것 같아서 만족스러워.,1
펀드에 넣어둔 자금이 많이 올랐어.,1
