text,label
비가 와서 울적했던 날에 우연히 길에서 보고 싶었던 전 여자 친구를 만나서 기뻤어.,1
배고파서 떡볶이를 만들었는데 엄마가 맛보더니 맛있다고 칭찬해주셨어.,1
나 오늘 너무 행복한 일이 있었어!,1
친구 무리에서 오해가 생겨서 내가 왕따가 됐었는데 그 오해에 대해 다 풀어서 마음이 편해졌어.,1
지금 회사 사람들과 되게 잘 맞는데 잘 맞는 동료들이랑 잘 맞는 것도 진짜 감사한 일인 것 같아.,1
아내한테 전화가 왔어. 딸이 내가 바람피우고 있단 사실을 아내한테 알렸나 봐.,0
빨리 일을 하고 싶었는데 드디어 내일부터 복직이야.,1
아이가 교통사고가 났는데 다행히도 많이 안 다쳐서 다행이야.,1
오늘 직업 체험을 하고 왔는데 진짜 다양한 직업을 대할 수 있었어.,1
좋아하던 친구와 진짜 연애를 하게 되었어!,1
난 운전하는 게 제일 편안하고 즐거워.,1
어제 간암에 걸린 친구 병문안을 갔는데 뼈만 남은 모습을 보니 눈물이 났어.,0
앞으로 어떻게 살아야 할 지 답답하네.,0
나는 동료들처럼 진로 상담할 언니가 없어.,0
최근에 돈 때문에 너무 힘들었는데 내 죽마고우가 돈을 빌려줬어. 정말 고마운 친구야.,1
이 등과 점수 차이가 많이 나는 걸 보니 안심해도 될 것 같아.,1
지난달 남편이 지병으로 돌아가셨는데 아직도 믿겨 지지 않고 실감이 안 나.,0
나는 엄마가 매일 밥을 챙겨 줘서 너무 좋아.,1
회사에서 정년퇴직 후에 대리점 사장을 하면 어떻겠냐고 물어 보더군. 기분이 참 좋아.,1
일을 그만두면 난 쓸모없는 사람이 될 것 같아.,0
다른 건 차치하고 자식들이 내 건강 걱정은 할 필요가 없어서 좋아.,1
혹시 몸이 아파도 회사에 빠질 수가 없어서 너무 불안해.,0
오늘 면접에서는 다른 지원자에 비해서 내 행색이 너무 초라하다고 느껴졌어.,0
불필요한 회식을 강요하는 건 너무 싫어.,0
딸들에게 요즘 조심스러워지는 것 같아.,0
자꾸만 심장이 빨리 뛰는 것 같아. 어디 아픈 걸까 봐 불안해.,0
회사 전무님이 팀에서 나를 밀어내고 다른 사람을 꽂아주려고 하나 봐.,0
평소에 나를 괴롭히던 무리가 갑자기 사과하면서 이제 친하게 지내자고 했어.,1
남편이 공무원이라 삼십 년 근무하고 나면 연금이 바로 나오니까 그렇게 걱정은 안 해.,1
몸이 건강해서 가족들과 언제든 여행을 갈 수 있어.,1
사회적 격리 때문에 바깥에서 동창들 만나기가 꺼려졌는데 카톡이 살렸네.,1
남편이 스무 살이나 어린 비서와 바람이 났어. 나 어떡하지?,0
나이가 드니 고독해지고 주변인과의 관계도 줄어드니까 내가 무가치하다고 느껴져.,0
작은아들이 이번에 공무원 시험에서 떨어졌어. 하지만 나는 꼭 합격할 거라고 믿어.,1
우리 딸이 드디어 취직했어. 그것도 엄청난 대기업에 말이야.,1
아내가 나와 살면서 내 병간호와 가난에 못 이겨 결국 집을 나가버려서 너무 슬퍼.,0
스피닝 시작하면서 체중이 감량되고 있어. 너무 신나고 꿈만 같아.,1
남편이 그동안은 내 식단에 맞춰 줬는데 이제는 맛이 없어서 같이 못 먹겠다고 해.,0
나는 따돌림이나 당하려고 태어났나봐. 믿었던 친구들이 쓰레기통을 뒤집어 쓴 내 모습을 보고 전부 웃고 있더라.,0
내가 한 실수도 아닌데 나를 혼내니까 너무 당황스럽다.,0
내 사수는 다른 선배들보다 마음이 착한 분이신 것 같아.,1
남편이 재정적으로 노후에 대해 준비를 해뒀다니 이제야 안도감이 들어.,1
학교 선생님 진짜 날 짜증나게 하셔.,0
날 괴롭히는 애들을 또 봐야 하다니 힘들어.,0
예민해진 팀원들의 분위기를 바꾸려고 회식 자리를 마련했는데 잘 풀리지 않아 정말 화가나.,0
이달의 우수사원으로 뽑혔는데 축하받는 게 아직은 쑥스러워.,0
자식들이 이제 나에게 막 대하고 나를 무시해. 학대받는 느낌이야.,0
너무나 절망적이네. 어쩌면 좋을까?,0
나는 성적이 상위라서 부모님이 인정해.,1
형이 이번에 태권도 선수가 됐는데 금메달을 수상했어. 그래서 나도 기뻐.,1
이민 간 친구네로 일주일 놀러 갔다 왔어.,1
내가 붙임성이 좋아서 처음만난 사람하고도 잘 지내지.,1
내가 친구가 알려준 대로 시험 문제를 풀었는데 문제를 틀렸지 뭐야.,0
오늘 투자회사에서 재무 상담을 받고 왔어.,1
내가 사고로 다쳐서 다리를 약간 절어. 남자 친구는 그런 날 창피해하는 것 같아서 속상해.,0
나는 잔병치레해도 크게 아프지 않아서 건강에 자신 있어.,1
연금 납입 만기까지 십 년이 남았는데 몸이 계속 나빠져 큰일이야.,0
우리 부모님은 타인 시선을 너무 의식해.,0
이번에도 회사 승진 명단에 내가 없어서 힘들어.,0
어머니가 내가 금번 시험 잘 봤다고 최신 스마트폰으로 바꿔주시겠대! 너무 좋아.,1
이번에 내 계획대로 프로젝트가 진행될 거야.,1
내가 따돌림당한다는 것이 반 전체에 알려지고야 말았어. 죽고 싶은 심정이야.,0
내 생일날에 큰 프로젝트 또한 성공적으로 마무리해서 그 어떤 해보다 기쁜 생일이었어!,1
지금 난 엄청 행복해.,1
내가 무능하게 맞고 있던 모습을 좋아하는 애가 봐서 내 자신이 너무 하찮게 느껴졌어.,0
오늘 괴롭힌 무리들한테 통쾌하게 복수했어. 완전 신나.,1
친구들과 조별 과제를 하는데 내 실수로 인해 우리 조 전체가 점수를 낮게 받았어. 후회돼.,0
노후 준비에 필요한 돈을 다 모아놨어. 정말 다행이야.,1
수업시간에 한 번도 졸지 않고 오늘은 집중해서 수업을 들어서 만족스러워.,1
입원했을 때 남편이 나의 곁에서 항상 나를 지켜줬었어. 난 항상 그 상황이 만족스러웠어.,1
친구들은 확실한 목표가 있는데 나는 잘 하는 것도 없고 엄청 한심해.,0
여자 친구가 내 팔을 베고 자는 중인데 팔이 저려서 조심스럽게 팔을 뺐어.,0
오늘 내가 학교에서 도둑질을 했다는 오해를 받았는데 어머니는 날 마지막까지 믿어주셔서 정말 감사해.,1
지난 토요일에 짝사랑하던 철수에게 고백했는데 철수도 나를 좋아하고 있었대.,1
아내가 허리 수술을 받느라고 꼼짝 도 못 하다가 이제 서서히 움직이니까 너무나 좋아.,1
지금 코로나로 내 일을 못 하고 있어.,0
엄마랑 누나랑 또 다퉜다더라?,1
혼자 벌어서 가족들을 책임져야 하는데 돈이 부족해.,0
건강 검진 결과가 나왔는데 암이 재발했다는군.,0
곧 다음 달에 결혼을 하게 되었어.,0
연초 업무 목표 대비 이백 프로를 달성하라니 말이 돼?,0
남편 얼굴을 볼 때마다 이제는 구역질이 날 정도야.,0
치매에 걸려 딸을 잘 알아보지 못하는 나 자신이 너무 싫어.,0
공인중개사 시험 보러 갔는데 머리가 깨어질 듯 아파서 중단하고 시험장을 나와 버렸어.,0
내 적성에 맞는 일이 무엇인지 아직도 모르겠어.,0
열심히 공부해서 그런지 시험에서 모르는 문제가 없어서 편안했어.,1
드디어 항암치료가 끝났어. 오지 않을 것만 같은 날이었는데 감격스러워.,1
나 이직 성공했어.,1
내 친구를 계속 괴롭히는 애가 나에게 협박을 걸어와서 무서워.,0
코골이가 심해서 치료를 받았더니 아내가 드디어 편안하게 잠을 잘 자게 되어서 너무 기뻐!,1
열심히 오디션을 준비하던 친구가 이번에 티브이에서 나오는 것을 보고 너무 기뻤어.,1
나를 따돌리는 애들이 우리 반에 못 오게 선생님이 막아주시겠대. 마음이 놓여.,1
요즘 운동을 열심히 하고 있어.,1
새로운 사람에게 먼저 다가가는 게 어려워.,0
실수로 언니 얼굴에 상처를 냈지만 언니가 화를 내지 않아서 기뻤어.,1
나 좋아하는 사람에게 고백 받았어!,1
친구들한테 만나자고 해야겠어.,1
아이가 어느 정도 크니까 이제 덜 힘드네. 요즘 신랑도 집안일을 많이 하고 가족이 화목해진 것 같아서 좋아.,1
아빠가 사업 잘 돼서 내게는 새 지갑을 선물해 주셨어!,1
다리가 불편한데도 불구하고 손주와 목욕탕에 다녀왔어. 손주와 함께 가니 재미있었어.,1
우리 학과는 내가 생각했던 공부를 하는 곳이 아닌 것 같아. 정말 당황스러워.,0
남들은 늙어서 해외여행이다 걱정이 없는데. 나는 젊어서 하나도 준비를 못 한 것이 개탄스러워.,0
임신에 대해 부담이 강했었는데 계획을 차차 세우기로 해서 너무 기뻐.,1
천천히 나이 들어가면서 함께 할 이웃 노인이 있어서 좋아.,1
몸도 아픈데 왜 자꾸 일만 꼬이지?,0
아들이 결혼하고 나니까 이제 큰돈 나갈 일이 없는 거 같아서 뿌듯해.,1
내 환갑잔치에 손자들이 앞으로도 건강 하라고 케이크를 만들어왔어.,1
아들이 병원 갈 때 함께 가주고 병원비도 내줘서 너무 든든해.,1
그동안 남자친구 집안에서 결혼을 반대했었는데 결국 허락하셨어!,1
친구가 불황에도 장사가 잘 되어서 다행이야.,1
결혼을 왜 하지 않는 거야? 나는 비혼주의자들을 보면 이 사회에 도움이 안 되는 사람들처럼 느껴져. 꼴도 보기 싫어져.,0
회사 여직원 중 달리기는 내가 제일 빠르다고 생각해.,1
이번 모의고사를 잘 보면 좋은 대학에 갈 수 있을 것 같아 기뻐.,1
내가 다리를 저니까 아빠가 꼴 보기 싫다고 발로 찼어. 다음에도 또 그럴까 봐 걱정돼.,0
들어오는 수입이 없어 신용카드로 돌려막기를 하고 있어.,0
룸메이트와 생활하고 있는데 서로 일 분담이 잘돼서 기분이 좋아.,1
요즘 밤을 설치다 보니 스트레스가 심해.,0
친구들이 하나둘 결혼을 하니 덩달아 나도 마음이 급해져. 나도 서둘러야 하는 건가 싶고.,0
우울증으로 자살시도 해서 병원에 갔던 걸 노인정 사람들이 모두 알고 있었어.,0
내가 열심히 한 만큼 성적이 잘 나와서 행복해.,1
학교를 다녀왔는데 엄마의 눈시울이 불어져 있어서 조심스러웠어.,0
아 정말 회사 다니기 너무 싫어. 당장이라도 그만두고 싶어.,0
엄마가 청소하라고 했는데 성가셔서 천천히 해야겠어.,1
아내가 이제 건강해져서 여행도 다니고 있어. 그런 모습을 보는 것이 참 기뻐.,1
며칠 전에 내가 다른 반 애한테 맞고 있었는데 우리 반 반장이 나타나서 나를 도와줬어.,1
나는 젊어서 아내와 이혼하고 쭉 혼자 지내왔어. 종종 외롭기도 하고 쓸쓸하기도 했지.,0
나에게 잘 맞는 공부법을 찾은 거 같아서 기분이 좋아.,1
아내가 건강에 관심이 많아서 나를 잘 챙겨 줘. 아내 덕분에 내가 체력을 유지하는 것 같아.,1
저녁에 약속이 있었는데 야근을 안 해서 다행이야. 절대로 빠지면 안 되는 약속이었거든.,1
내가 계속 꿈꿔오던 직장 취업에 드디어 성공했어.,1
아이가 공부를 못해서 남 보기 부끄러워.,0
결혼 전 어머니가 안 계시는 나에게 시어머니께서 엄마처럼 생각해달라고 하셔서 감사해.,1
전 재산을 털어서 수술을 하려고 하는 데 수술을 해서 나아질까 싶어서 짜증 나.,0
나 복권에 당첨됐어!,1
내가 술만 마시면 다혈질로 가족들에게 상처를 줘서 이혼하게 되었어. 가족들에게 너무 미안해,0
그녀는 항상 나를 기다려줬어. 부끄럼이 많은 내가 귀찮을 만한데 말이야.,1
내가 후원금을 넣었던 단체에서 감사패를 보내와서 기뻐.,1
재개발 한다는 땅을 미리 사놓은 나는 가족들의 영웅이 되어 기뻐.,1
나는 이 기업에서 꾸준히 일을 해서 정년퇴임을 할 수 있어.,1
아내와 마음이 안 맞아 이혼을 하게 됐는데 혼자 사는 게 생각보다 쉽지 않네.,0
그동안 열심히 살아왔는데 노후준비가 충분하지 못 하여 아주 힘든 시간을 보내고 있어.,0
난 남자친구한테 너무 희생하는 거 같아.,0
이번에 처음으로 같이 일하게 된 다른 부서 직원이 일솜씨가 좋아 오늘 일찍 끝나겠어.,1
연금복권에 당첨돼서 정말 다행이야. 앞으로는 병원비 걱정할 필요가 없겠어.,1
점심을 조용히 혼자 먹고 싶은데 사람들이 다 같이 모여들어서 성가셔.,0
자식들이 생활이 어렵다고 생활비를 못 준다더군. 자식들 도움 없이 앞으로 어떻게 살아가야 할지 막막하고 암울해.,0
자식들은 고혈압이 없어서 다행이야. 내가 고혈압이 있어서 걱정했는데 말이야.,1
마지막 순간이 다가온 것을 알고 날 위해 고생한 아내에게 모든 걸 위임했어.,1
사랑받는 아이로 키우고 싶었어. 하지만 말을 안 들으니까 자꾸 화만 내게 돼.,0
나 다음 주에 결혼해.,1
이번에도 공무원 시험에 떨어져서 부모님 가게에서 일하게 돼서 기분이 안 좋아.,0
은퇴 후 지낼 집을 무리해서 샀는데 감당이 안 돼. 손해를 보고 팔아야 해서 우울해.,0
나는 아직 건강하고 힘이 넘치지만 가족들은 내가 얌전히 집에 있기를 바라는 것 같아서 당황스러워.,0
기본적인 예의도 갖추지 않았으면서 본인이 솔직하다고 생각하는 사람들을 대하는 것이 힘들고 괴로워.,0
동네 사람들이 다른 사람의 말만 듣고 오해해서 모두 나를 손가락질했어.,0
얼마 전 회사를 이직했는데 지금 거기서 구조조정 얘기가 나오고 있어서 다행이야.,1
딸이 이번에 좋은 사람과 결혼해.,1
지금 그럴 형편이 아닌데도 친구들 따라서 보험에 들었어.,0
노력한 만큼 성과를 얻어서 만족스러워.,1
환갑이 넘으니 관절이 말을 안듣네.,0
옛날과 다르게 요즘 친구들이랑 있으면 맥 빠지는 기분이야.,0
병원에 다녀왔는데 이젠 아기가 잘 크고 있으니 너무 큰 걱정은 하지 않아도 된대.,1
의사의 말로는 내 방광암이 화학품 공장에서 일해서 걸린 거래. 너무 충격적이야.,0
노후 준비 다 해놓으니까 안심이네. 참 행복해.,1
우리 커플에 대해 미리 생각은 해두었지만 가족 모두가 반대할 거라고는 생각도 못해서 당황스러워.,0
고립된 기분이야.,0
이번 주에 팀에 바쁜 일이 많은데 휴가를 내야 할 것 같아. 눈치가 보이네.,0
어제 아들내미가 직장에서 승진했다고 저녁에 식구들이랑 같이 외식을 했어. 얼마나 기쁘던지 이런 게 행복인 거겠지.,1
나는 우리 아이들이 무슨 일을 하든 믿고 응원해줄 예정이야.,1
화가 나도 사표를 쓰지 말아야 했어.,0
내가 같은 연령대보다 아픈 곳이 많은 걸 알게 됐어. 자기 관리를 못 하는 나는 바보야.,0
나 오늘 생일이야!,1
나만 취업이 안 돼. 다른 친구들이 다 취업이 되었는데.,0
내가 외박을 하고 오는 날엔 나 없이 가족들이 항상 외식을 해서 속상해.,0
최근에 부모님께서 싸우셨고 아빠가 던진 물건에 내가 맞아서 어깨랑 마음이 아파.,0
엄마가 절대 안 된다고 하셨던 아이돌 굿즈를 흔쾌히 사주 신대! 너무 기뻐!,1
성적이 잘 나와서 선택지가 많지만 너무 거기에만 매몰될 것 같아서 천천히 정하려고 해.,1
대학을 졸업했는데. 전공과목에 맞춰서 진로를 정해 직장을 구하기가 힘들어.,1
나 우리 집은 화평하고 싸움이 없어서 늘 맘이 편안하지.,1
정말 고마운 일이 있어.,1
중학생인 나는 우리 가족관계가 너무 만족스러워.,1
날 찾아오는 사람은 택배기사뿐이라서 너무 외롭고 슬퍼.,0
나와 결혼하기로 한 사람이 있는데 요즘 들어 힘들 때 응원이 아닌 상처를 줘.,0
작은아버지가 돌아가셨어. 너무 슬퍼.,0
지점장이 무슨 일이 생기더라도 나를 믿어줘서 너무 다행이야.,1
아내가 죽었어. 나 때문인 것 같아 우울증도 생겼어.,0
내가 새로운 프로젝트를 주도하게 되었다니 믿을 수가 없어.,1
엠티로 우리 부서의 친목을 도모할 수 있을 거라 믿어.,1
모두 내 나이를 알면 깜짝 놀라며 건강의 비법이 무엇이냐고 자주 물어봐.,1
건강검진을 받느라고 너무 힘들었어.,0
내 건강을 상담해 주는 신뢰할 수 있는 의사 선생님이 계셔서 좋아.,1
아들이 사람들과 잘 어울리지 못하는 것 같아서 걱정이야.,0
지금 회사에서 받는 월급이 만족스럽지가 않아.,0
내 친구 욕을 했던 애한테 어떻게 복수를 할지 고민하고 있어.,0
아빠가 재혼하셨는데 새엄마 성격이 만족스러워.,1
이번 프로젝트를 잘 마치고 인센티브를 받았어.,1
나 요즘 너무 기뻐!,1
시험 공부 때문에 너무 힘들고 괴로워. 오늘은 잠도 네 시간 밖에 못 잤어.,0
어머니의 공부 잔소리가 이젠 지긋지긋해. 구역질 나올 것 같아.,0
중요한 일 처리하고 있는데 긴급하게 또 일이 들어왔네.,1
인적 관리가 되게 어려운데 내가 잘하고 있다는 칭찬을 상사에게 들었어! 온종일 뿌듯해.,1
오늘 생활기록부를 봤는데 감동했어.,1
내가 따돌림당하고 있다는 사실을 부모님에게 이야기하고 싶어서 안달이 나.,0
치매 걸린 마을 할머니가 자꾸 우리 집을 자기 집인 양 찾아와서 가질 않아.,0
모임에 나갔는데 다른 부부들이 우리 부부보다 건강해 보였어.,0
사십 대라 이직에 대한 부담이 컸었는데 좋은 회사로 이직한 것 같아서 다행이야.,1
내가 죽고 나면 나를 아무도 기억하지 못할까 봐 걱정이 돼.,0
부장님이 업무지시를 한 번에 했으면 좋겠는데 자꾸 호출하셔서 엄청 성가셔.,0
아내가 내가 벌어다 주는 적은 돈으로 큰살림을 꾸려나가는 걸 보면 안쓰러워.,0
나는 고민하느라 고생하는데 직장 상사는 항상 빠르게 처리하더라. 역시 대단하다는 생각이 들면서도 재수 없어.,0
나 자존감이 떨어지고 너무 슬퍼.,0
자식들이 힘든 일이 있을 때 도와주겠다고 해서 기뻐.,1
오늘 성적이 오른 걸 보고 너무 신나서 어떻게 해야 할지 모르겠어.,1
요즘 폐지 줍는데 모은 돈으로 약을 사고 나면 굶어야 돼.,0
이 회사가 중점적으로 보는 자격증은 하나뿐이라서 여유가 있어.,1
나 다음 달에 결혼하게 됐어.,0
대학원에 진학하고 싶은데 집안 반대가 심해.,0
내가 회사에서 잉여자원인 것 같아서 불안해.,0
요즘 바깥 활동을 전혀 안하니까 우울증이 도진 것 같아.,0
오늘 병원에 다녀왔는데 건강검진 결과가 좋지 않아서 기분이 상당히 우울해.,0
드디어 취업에 성공했어. 이번에도 못 하면 어쩌나 했는데 정말 다행이야.,1
그동안 괴롭힘을 당해 학교 생활이 힘들기만 했는데 가해자들이 전학을 가서 상황이 달라졌어.,1
혼자라서 쓸쓸했을 때 다행히도 내게 말을 걸어 주는 노인에게 고마웠어.,1
따돌림 당하는 친구를 돕다가 나도 따돌림 당할까 겁이 나.,0
얼마 전에 남편이 지갑을 분실했다가 찾았어.,1
벗들이 은근히 나를 따돌리고 있는 것 같아.,0
부모님이 용돈을 올려주신대!,1
비록 몸이 젊을 때 만큼 팔팔하지는 않지만 남의 부축 없이 다닐 수 있으니 감사를 해야지.,1
어려울 때 도와준 친구가 이제 나에 대해서 좋지 않은 소문을 퍼뜨리고 다녀서 고민이야.,0
직장 상사가 나한테 일도 제대로 알려주지 않고 일만 많이 줘서 너무 힘들어.,0
친구들이 은근히 나를 따돌리는 것 같아서 불만이야.,0
친구들보다 앞에서 걸으면 내 뒷모습이 신경이 쓰여.,0
요즘 코로나 때문에 운동도 안 하는데 살이 찌지는 않는 것 같아.,1
드디어 원했던 직장에 합격하게 되어서 마음이 편안해.,1
나 어제 엄마한테 심한 말을 한 것 같아 무척 죄송해.,0
정말 오랜만에 낮잠을 자서 기분이 좋아.,1
아내가 출산했는데 출산 과정에서 문제가 있었어. 뭐 다행히 잘 마무리는 되서 다행이긴 하지만 한편으로는 너무 힘들었어.,1
건강 검진을 받았는데 신체 나이가 삼십 대로 나왔지 뭐야.,1
엄마가 재혼하고 관계가 소원해졌어. 내가 먼저 다가가고 싶은데 그러고 싶지 않아.,0
나이가 드는 게 너무 서러워.,0
너무 욕심을 부렸나 봐.,1
우리 회사에 나랑 친하지 않은 사람이 있는데 그 사람 때문에 불편한 기분이 들어.,0
오늘은 감사한 날이야.,1
남편도 죽고 언니도 죽었어. 나이가 들어서 주변 사람들이 떠나가니까 고독에 시달려.,0
오늘 저녁 먹는데 남편이 사장으로 승진했대. 너무 기쁜 일이야!,1
지금 내 남편을 만난 건 행운이야.,1
이제 노인정 실내에서 흡연을 금지하기로 했어.,1
우리 반 아이들 중 미래가 결정되지 않은 학생은 나밖에 없어.,0
오늘 직장에서 속상한 일이 있었어.,0
처음으로 아빠 생신 때 미역국을 직접 끓여 드렸어.,1
요즘 매일 야근이라 피곤하고 힘든데 상사 덕분에 다행이야.,1
나의 성적을 볼 때마다 너무 짜증나.,0
난 이제 살 만큼 살았는데 왜 아직도 몸이 멀쩡한지 모르겠어.,0
이번 큰 성과를 내어 곧 정년퇴직을 하는데 회사 동료들에게 명예롭게 퇴직할 수 있을 것 같아.,1
나는 이 마을 사람들과 매우 좋은 관계를 유지하고 있어서 만족스러워.,1
친구들이 내 뒤에서 몰래 내 흉을 보는 것 같은 기분이 들어서 불안해.,0
나 대학에 쉽게 갈 수 있을 것 같아. 학원 선생님들 실력이 정말 믿을 만해!,1
오래전부터 진학하고 싶었던 대학에 합격을 했어.,1
요즘 노인정 가는 게 즐거워 .,1
업무를 할 때마다 고립돼서 스트레스받아. 이제 나이도 많이 먹어가는데 말이야.,0
이번에 사귄 남자친구에게 신뢰가 많이 쌓였어. 이런 적이 너무 오랜만이라 마음이 편하다.,1
건강한 건 참 좋은데 너무 가난해서 나 자신이 너무 초라해.,0
경조사 비용으로 쓸 돈을 따로 마련해 둔 덕분에 내 노후 자금 관리에 타격이 없어서 기뻐.,1
온종일 점심시간 빼놓고 공장 밖을 못 나가니 너무 답답해.,0
회사에서 하는 모든 일이 비생산적인 것 투성인 거 같아.,0
아이돌 가수가 되면 성공할 자신 있어.,1
사정으로 고등학교 졸업을 못했는데 동창회를 가는 친구들을 보면 부러운 동시에 상실감이 커.,0
나 어떡하면 좋지? 지금 너무 당황스러워.,0
남편이 요즘 애정표현을 많이 해줘서 기분이 좋아.,1
요즈음 건강이 부쩍 나빠진 것 같아서 걱정이야.,0
나는 커서 뭐가 될까? 진짜 모르겠어.,0
내가 천식이 있는데 노인정에서 김 씨가 자꾸 담배를 피워.,0
나에게 잘해주는 최 씨 할머니 때문에 기뻐.,1
내가 타 부서에서 책잡힐 일을 했는데 김 팀장이 내 편을 들어줬어. 너무 기쁘고 감사해.,1
나 원하는 대학에 진학할 수 있을 것 같아. 자신있어!,1
노후준비를 해놓지 않았더니 이렇게 나이를 먹고도 일을 해야 하는 상황이 왔어.,0
어제 그동안 다니던 노인 대학을 그만두었어.,0
공부만 하니까 너무 힘들어 가만히 앉아 있는 것도 지치고.,0
귀가 안 들려서 사람 만나는 것이 꺼려져.,0
딸이 내 병문안을 오다가 교통사고가 났어. 전화를 받지 않아. 너무 걱정돼.,0
철없던 자식들이 집안 재정에 관심을 가진 것만으로도 난 만족해.,1
나 어제 우리 과장님께 업무를 꼼꼼히 한다고 칭찬받았어.,1
이번 주말엔 아내랑 오랜만에 데이트를 할거야. 어쩐지 연애 때 기분도 나고 설레는구먼.,1
요즘 정말 기분이 좋아.,1
맨날 회사 간식을 다 먹어치우는 직원이있는데. 그 직원이 먹는 것 보면 혐오스러워.,0
아이가 아빠 생일이라고 그림을 그려줬어.,1
나는 큰 병이 있어서 몸도 움직이지 못했어. 그런데 이제는 일도 나가고 얼마나 감사한지 몰라.,1
아직 신혼인 친한 친구가 아이를 낳게 되면 나처럼 키우고 싶다고 했어!,1
오늘 오랜만에 가족 외식을 나가기로 했어.,1
노안 수술을 하고 나니 너무 잘 보여서 왜 더 빨리 안 했나 후회가 되네.,0
내가 따돌림당하고 있다는 걸 선생님께 말씀드리고 났더니 훨씬 편해졌어.,1
반 애들이 내 키가 작다고 놀려서 짜증나.,0
내가 싫어하던 선배 욕을 하고 있었는데 선배가 그걸 우연히 듣게 되었어.,0
부모님이 다시 잘 지내는 모습이 보기좋아.,1
나 이번에 회사에서 승진했어! 진짜 기뻐.,1
팔십 살이 되니 몸이 예전 같지 않아. 이젠 아침에 일어나는 일도 버겁군.,0
